Name	title	coding
t3_17ug159	"COMP-348, curve?"	class specific question
t3_17rsbn2	Rate concordia's mental health programs	health
t3_17t2oi0	Thoughts on Phil 235 Biomedical Ethics?	class specific question
t3_17tlias	Where to buy Mate Libres on campus or close to campus?	general question
t3_17tmxen	Gradesavers	general question
t3_17tmxg7	COMP 249 Grading	class specific question
t3_17te2sk	Looking for a job	extracurricular topic
t3_17q8jcp	How to study for chem 205	class specific question
t3_17qyfaf	Math 209	class specific question
t3_17sl2nh	AFE quebec student Loan repayment calculation	general question
t3_17rfuk7	Exercise science students at Loyola	health
t3_17qadig	MPPPA Program	degree question
t3_17riyfg	Philosophy 201	class specific question
t3_17qap1x	Is comm205 an easy b? Or it’s difficult	class specific question
t3_17qb6sx	"Going from udem to concordia, grades conversion"	degree question
t3_17rxzfh	sphrconu statement regarding November 8.	political
t3_17qhmul	Job in montreal	extracurricular topic
t3_17r247t	Trending on Twitter for all the wrong reasons	political
t3_17qc2nu	Wizprerp discount code	extracurricular topic
t3_17qweo2	Clean bathrooms	health
t3_17rhkhh	CIBC ASG Analyst Interview	extracurricular topic
t3_17romq9	admission acceptance option not showing up	general question
t3_17qzysu	M.Eng in Information Systems Security	degree question
t3_17q9lqk	Is the Kenneth Woods Portfolio Management only for year 1 students?	degree question
t3_17rieql	"UdeM Professor Yanise Arab yells at a Jewish student in Concordia to “go back to Poland, sharmouta (wh*re)”"	political
t3_17qddjg	Is it fine to wear a hat or a cap during exams?	general question
t3_17r7txt	International Student from US - Do I need a CAQ or study permit if I'm only going to be here for less than 6 months?	degree question
t3_17t27ej	Poster Sale	extracurricular topic
t3_17s5496	MATH208 Midterm Grade	class specific question
t3_17rbjr1	I’m really confused right now and would appreciate some advices. Should I drop out of coop after completing an 8 month WT and still hold a part-time job with the employer or does the coop stamp really worth it?	general question
t3_17tnuk2	Mechanical and building engineering internships	degree question
t3_17rik3r	Full time or part time	general question
t3_17siidt	extra assignment for bonus points	general question
t3_17qq0xu	Concordia continuing education	degree question
t3_17tskx8	Admission grade transfer student	degree question
t3_17qsv34	Against tuition hike? Write your MNA	political
t3_17tb9ew	Accounting Major	degree question
t3_17uhyr1	Is the course evaluation mandatory?	general question
t3_17tpw3f	Any good elective recommendations?	degree question
t3_17u4efl	need help with registration!	general question
t3_17qvwo0	What are the easiest electives?	general question
t3_17tma1e	Gina Cody School Course Offerings for Exchange Students	degree question
t3_17u0hsj	Concordia Alum Christopher Curtis Wins Prix Judith-Jasmin in Sports Journalism for this article	extracurricular topic
t3_17r344d	What actually happened in the H building today	general question
t3_17s55fu	How to accept offer of admission?	general question
t3_17qoaxo	MATH 201 Midterm	class specific question
t3_17ujbbg	How likely is it to get accepted into a second degree in accountancy?	degree question
t3_17rgawn	Update on brawl at Concordia.	political
t3_17rv6vm	Help me please to select SOEN elective	degree question
t3_17s5uob	I need one more year to complete my studies. Do I need my 5th year to be approved by the school?	general question